{
"scenarioType": "SC-01",
"planningContext": {
"horizon": {
"dateDebut": "2026-05-11",
"dateFin": "2026-05-17"
},
"strategieScoring": "EXPLOITATION"
},
"scenarioParameters": {
"resourceRef": {
"id": "SAL-1001"
},
"dailyAmplitudeHours": 7,
"shiftStart": "09:00",
"workedDays": [
"MONDAY",
"TUESDAY",
"WEDNESDAY",
"THURSDAY",
"FRIDAY"
],
"lunchBreak": {
"start": "12:00",
"end": "13:00"
},
"holidayDates": [
"2026-05-13"
]
},
"dataSet": {
"referentiels": {
"activites": [
{
"codeActiviteId": "travail",
"compteDansCharge": true,
"genereDetteRepos": false,
"estServiceCritique": false
}
]
}
}
}
