{
"scenarioType": "SC-01",
"planningContext": {
"horizon": {
"dateDebut": "2026-07-27",
"dateFin": "2026-08-02"
},
"strategieScoring": "EXPLOITATION"
},
"scenarioParameters": {
"resourceRef": {
"id": "10212"
},
"dailyAmplitudeHours": 7,
"shiftStart": "09:00",
"workedDays": ["MONDAY","TUESDAY","THURSDAY","FRIDAY"],
"lunchBreak": {
"start": "12:00",
"end": "13:00"
},
"holidayDates": [""]
},
"dataSet": {
"referentiels": {
"activites": [
{
"codeActiviteId": "113",
"compteDansCharge": true,
"genereDetteRepos": false,
"estServiceCritique": false
}]
}
}
}